,address,postal_code,rest_name,average_cost,additional_info,rating,rating_category,review,review_date_time,user_name
1385,"205 East Houston Street, New York, NY 10002",NY 10002,Katz's Delicatessen,30,"['Breakfast', 'Takeout Available', 'Wine and Beer', 'Kosher']",4.9,excellent,"RATED
  So happy I went here on my trip to NYC, you cannot get this level of sandwiches in Australia. Really enjoyed the atmosphere of this place and it was very kind of the chef's to let us try out the meat (mmmm...). I would visit NYC again just to eat here at Katz's Deli.

Reviewed by, fellow Aussie.",19-Jun-15,Themelbguy
1386,"205 East Houston Street, New York, NY 10002",NY 10002,Katz's Delicatessen,30,"['Breakfast', 'Takeout Available', 'Wine and Beer', 'Kosher']",4.9,excellent,"RATED
  A classic and a must when you travel to NYC. The pastrami sandwich it to die for. When it arrived I thought I wouldn't be able to eat it all, but I did. And I would eat more! Place is full of tourists AND locals. It has the walls Co Reed with photos of famous persons who visited this NYC institution.",19-Jun-15,Pedro Ramos
1387,"205 East Houston Street, New York, NY 10002",NY 10002,Katz's Delicatessen,30,"['Breakfast', 'Takeout Available', 'Wine and Beer', 'Kosher']",4.9,excellent,"RATED
  The pastrami is the best in the world. That's it. That should convince everyone to visit Katz and sample it. My only gripe is the size of the sandwich, about a pound's worth of pastrami goes into every sandwich. Best to share. Mustard is also good.",18-Jun-15,Triska
1388,"205 East Houston Street, New York, NY 10002",NY 10002,Katz's Delicatessen,30,"['Breakfast', 'Takeout Available', 'Wine and Beer', 'Kosher']",4.9,excellent,"RATED
  Why are people suprized?. When you walk through the door it hits you. You see what NY is all about. The history behind this place is why you come in the first place. Anyone that is anyone has stepped foot in this place at some point or another. Why? The sandwich lovers out there know why. You will be hard pressed to find a better one anywhere on this scale. How they manage to make a decision so hard is quite an accomplishment. Yes there will be one person that disagrees out of thousands... think about that for a second... It should be a anyone's bucket list when coming to one of, if not the best cities on earth. A half sandwich and salad for $15 is the least of your worries. This place is a classic that you want to experience. By the way, the food is amazing...",20-May-15,NYC KID
1389,"205 East Houston Street, New York, NY 10002",NY 10002,Katz's Delicatessen,30,"['Breakfast', 'Takeout Available', 'Wine and Beer', 'Kosher']",4.9,excellent,"Long queues but worth the wait at Katz. Had to wait a long time for service, but everybody in the queue was waiting patiently and were friendly. I figured it must have been worth the wait, and it was. Had the Reuben - incredible. My GF had the pastrami sandwich, equally as good. Wish i could have gone back to try some others.",20-May-15,Jonnybgoodston
1390,"205 East Houston Street, New York, NY 10002",NY 10002,Katz's Delicatessen,30,"['Breakfast', 'Takeout Available', 'Wine and Beer', 'Kosher']",4.9,excellent,"POSITIVE
   Big sandwiches at big prices - I no longer want what she's having.. I've never been big on crowded places or standing in line for service. Katz is all that and a bit more. However, at the end you can have a pretty pricey classic hot pastrami on rye with about any combination of sauces and mustards,, and a pickle. A great place to 'people watch' and see how many repeat Megs famous words 'I want what she's having'.
I wonder - Can men and women ever just be friends ??? I guess you will never know until you visit Katz Deli.",14-May-15,Jimmy D (Top Rat At R.A.T.S.)
1391,"205 East Houston Street, New York, NY 10002",NY 10002,Katz's Delicatessen,30,"['Breakfast', 'Takeout Available', 'Wine and Beer', 'Kosher']",4.9,excellent,"RATED
  This iconic New York landmark left two of our party in a food coma after the best Reubens they'd ever eaten. Famous people in photos adorn the walls and a sign points to ""Where Harry met Sally"". Worth a visit.",9-May-15,Dale Bedford
1392,"205 East Houston Street, New York, NY 10002",NY 10002,Katz's Delicatessen,30,"['Breakfast', 'Takeout Available', 'Wine and Beer', 'Kosher']",4.9,excellent,"RATED
  Established in 1888 and been in same location since 1917, the Ruben was on my to do list all week in NYC and it didn't disappoint.. Battles to finish it, great vibe and great piece of NY history",9-May-15,Collin Allin
1393,"205 East Houston Street, New York, NY 10002",NY 10002,Katz's Delicatessen,30,"['Breakfast', 'Takeout Available', 'Wine and Beer', 'Kosher']",4.9,excellent,"POSITIVE
   Although pricey it's a Must try!. We came here early to try their famous pastrami on rye. We got to sample their pastrami and it was warm, tender and delicious!

As it was for breakfast, my husband and I shared one and thought it was flavoursome but it is pricey for a sandwich. Still, when visiting NYC, it's a must on the eating list",28-Apr-15,Miffy7
1394,"205 East Houston Street, New York, NY 10002",NY 10002,Katz's Delicatessen,30,"['Breakfast', 'Takeout Available', 'Wine and Beer', 'Kosher']",4.9,excellent,"The Pastrami is made from beef brisket (navel end) that is cured, seasoned and smoked which gives it its incredible texture. At Katz?s, the pastrami is made in house and sliced right in front of you, served with a smear of mustard. Their perfected technique results in a flavoursome, tender and almost melt in your mouth... ...
Read full post on tabletopaper.com",4-Apr-15,Table To Paper
1395,"205 East Houston Street, New York, NY 10002",NY 10002,Katz's Delicatessen,30,"['Breakfast', 'Takeout Available', 'Wine and Beer', 'Kosher']",4.9,excellent,"Traditional cuisine. Clean and elegant surroundings, delicious cuisine.??? subtitl.xyz",31-Mar-15,Vovogoing
1396,"205 East Houston Street, New York, NY 10002",NY 10002,Katz's Delicatessen,30,"['Breakfast', 'Takeout Available', 'Wine and Beer', 'Kosher']",4.9,excellent,"NEGATIVE
   Expensive and mediocre. My former NYer husband and I hit Katz's last night on the city. We were looking forward to the classic deli food. He ordered the corned beef sandwich ($19!) which came cold, sliced thick and fatty. I ordered the tuna ($13), soggy chunk light. I paid $5.50 for slaw, so runny, white goo slopped over the plate. Also a knish, that was frozen and then microwaved into basically a ball of mashed potatoes.

The best part of the meal was the pickles, mustard, and the Dr Brown's ($2.75 a can!), none of which is made at the deli.

We came in, dropped $50 for two sandwiches, and we can say we're over the Katz's experience.",19-Mar-15,Lisa Mann
1397,"205 East Houston Street, New York, NY 10002",NY 10002,Katz's Delicatessen,30,"['Breakfast', 'Takeout Available', 'Wine and Beer', 'Kosher']",4.9,excellent,"The last place we dined at during our short, but enjoyable trip to the Big Apple was at Katz's Deli. Of all of the food landmarks that New York City is home to, there's no doubt that the 125-year-old Katz's is quite possibly the most famous one around! People travel from abroad to experience what Katz's has to offer and both locals and tourists alike love this place enough to keep the lines going out the doors on a daily basis. Luckily on the day of our visit, we came in at just the right time and waited no more than ten minutes for our sandwich. I can't say the same for the customers behind us because within 20 minutes of our arrival, the line was out the door again. ...
Read full post on bellavivere.blogspot.com",12-Mar-15,Bella Vivere
1398,"205 East Houston Street, New York, NY 10002",NY 10002,Katz's Delicatessen,30,"['Breakfast', 'Takeout Available', 'Wine and Beer', 'Kosher']",4.9,excellent,"This blog post contains a video. ...
Read full post on marcs-culinary-compass.com",11-Mar-15,Marc.osten
1399,"205 East Houston Street, New York, NY 10002",NY 10002,Katz's Delicatessen,30,"['Breakfast', 'Takeout Available', 'Wine and Beer', 'Kosher']",4.9,excellent,"POSITIVE
   The Pickles ...Full Sour and Also the Green Tomatoes. Salt and makes your mouth pucker like no one elses.

-----11 Mar, 2015-----
Lets keep it simple - I love Katz's!. I adore Katz's. On my most recent visit I took some great video that will give you a real feel for the place. Yes the pastrami makes it special but it's the people who make it memorable. Enjoy http://www.marcs-culinary-compass.com/2015/03/episode-142.html",11-Mar-15,Marc.osten
1400,"205 East Houston Street, New York, NY 10002",NY 10002,Katz's Delicatessen,30,"['Breakfast', 'Takeout Available', 'Wine and Beer', 'Kosher']",4.9,excellent,"I?ve never had Pastrami served piping hot, but I don?t think I can have it served any other way ? it was absolutely amazing! I was also surprised at just how much meat they packed in.
The Brisket was great, but for me, the pastrami just had so much flavour that it wins hands down. ...
Read full post on eatshowandtell.com",28-Jan-15,Squishies Eats
1401,"205 East Houston Street, New York, NY 10002",NY 10002,Katz's Delicatessen,30,"['Breakfast', 'Takeout Available', 'Wine and Beer', 'Kosher']",4.9,excellent,"POSITIVE
   Go at least once - I promise you'll be back. Katz deli is popular for a reason, not just for the famous scene with Meg Ryan in 'When Harry met Sally'. Whenever a friend of family member from outside NY comes, I always take them to this iconic place. Despite the not-so-cheap prices and long line-ups, the sandwiches are worth it. Lots of other things to eat here, but I prefer going for some good old pastrami or reuben. Yes, these sandwiches are on the high-end, costing aprox. $20 a piece, but they are huge. No other place can match them.",21-Jan-15,Victorgoldber
1402,"205 East Houston Street, New York, NY 10002",NY 10002,Katz's Delicatessen,30,"['Breakfast', 'Takeout Available', 'Wine and Beer', 'Kosher']",4.9,excellent,Lots of history. Get ready for a large pastrami! A definite historical part of NY that everyone should experience,16-Jan-15,Tkaull
1403,"205 East Houston Street, New York, NY 10002",NY 10002,Katz's Delicatessen,30,"['Breakfast', 'Takeout Available', 'Wine and Beer', 'Kosher']",4.9,excellent,"RATED
  This place is an icon of the former Jewish neighbourhood and of New York. The delicious, massive, ridiculously, overfilled pastrami sandwich is excellent, so too, the matzo ball soup and knish. A must visit place. Yum ...
Read full post on perthfoodreviews.com",12-Jan-15,Shaun
1404,"205 East Houston Street, New York, NY 10002",NY 10002,Katz's Delicatessen,30,"['Breakfast', 'Takeout Available', 'Wine and Beer', 'Kosher']",4.9,excellent,"Great Food!. As a child in 1951, with my father, we went to Katz's Delicatessen many times. Although they were always busy, we could always muster up the strength to wait for a table, especially with the aroma of a fine delicatessen wafted through the air. I went back years later after moving out of state. I could swear that everything was almost the same, including some of the workers. I understand why they won first place for their pastrami sandwich. If I wasn't currently living in Georgia, This place would be a monthly event for me. Thank God that they kept up the image of the brothers.
Richard Radzik",17-Dec-14,Richard
1405,"205 East Houston Street, New York, NY 10002",NY 10002,Katz's Delicatessen,30,"['Breakfast', 'Takeout Available', 'Wine and Beer', 'Kosher']",4.9,excellent,"POSITIVE
   I'm craving for the pastrami. Why dont we have anything like this in Sydney!! these guys know how to make a sandwich. went twice, first time had the pastrami, second time the Reuben. the pastrami was probably my favourite.
a must visit when in NYC.",9-Dec-14,Zebedee
1406,"205 East Houston Street, New York, NY 10002",NY 10002,Katz's Delicatessen,30,"['Breakfast', 'Takeout Available', 'Wine and Beer', 'Kosher']",4.9,excellent,"The ?World Famous? moniker is often over-used by restaurants.  These guys have a claim on that title, and they don?t need Buddy the Elf to anoint them either.   ...
Read full post on slcfoodradar.com",5-Dec-14,Hyrum Romrell
1407,"205 East Houston Street, New York, NY 10002",NY 10002,Katz's Delicatessen,30,"['Breakfast', 'Takeout Available', 'Wine and Beer', 'Kosher']",4.9,excellent,"Ridiculous prices. This was recommended by a fellow from food on foot tours. We wentt a few days later and had the recommended pastrami sandwich. You receive a number when entering the deli, no prices for sandwiches were available, when our sandwich was made a price was written on the number ticket. The price was 19.75!!!! Are you kidding me!!!! It's criminal! We were so shocked we paid and left. Nothing Is worth 19.75 for a sandwich.
Stay away!!!",4-Dec-14,Strawdawg
1408,"205 East Houston Street, New York, NY 10002",NY 10002,Katz's Delicatessen,30,"['Breakfast', 'Takeout Available', 'Wine and Beer', 'Kosher']",4.9,excellent,"Without a doubt, Katz?s Deli (@ KatzsDeli) is one of the most iconic restaurants in New York. Sure, it?s an incredibly touristy spot and the prices reflect that, but they serve some of the best pastrami I?ve ever had. ...
Read full post on wherejessate.com",27-Nov-14,Jess W.
1409,"205 East Houston Street, New York, NY 10002",NY 10002,Katz's Delicatessen,30,"['Breakfast', 'Takeout Available', 'Wine and Beer', 'Kosher']",4.9,excellent,"Appalling service stemming from a complete misunderstanding.. Not having been to the deli before, we accidently sat at the 'service only' table thinking it was like all the tables nearby.
When a waiter came, we said we didn't want service so we could order at the counter ourselves.
Pointing to a sign on the wall his response: ""Well get the f**k out.""
Never in my life have I had someone swear at me like that - I expected it to be a joke.
He simply could've said we'd need to move to the other tables.
Disappointing.",30-Oct-14,Cyndi
1410,"205 East Houston Street, New York, NY 10002",NY 10002,Katz's Delicatessen,30,"['Breakfast', 'Takeout Available', 'Wine and Beer', 'Kosher']",4.9,excellent,"POSITIVE
   Cannot understand any poor reviews here. This is a must do in any New York trip, I just wish we could get something as good back in Australia. The pastrami is unbelievable. Yes you have to wait to order and tables are hard to get but that's generally a sign of a great eatery which this most certainly is!",26-Oct-14,Steven
1411,"205 East Houston Street, New York, NY 10002",NY 10002,Katz's Delicatessen,30,"['Breakfast', 'Takeout Available', 'Wine and Beer', 'Kosher']",4.9,excellent,"This blog post contains photos only. ...
Read full post on spoonfulsofwanderlust.com",4-Aug-14,Spoonfuls Of Wanderlust
1412,"205 East Houston Street, New York, NY 10002",NY 10002,Katz's Delicatessen,30,"['Breakfast', 'Takeout Available', 'Wine and Beer', 'Kosher']",4.9,excellent,"NEGATIVE
   Not worth the hype or price. Go somewhere else for a better experience and quality.",24-Jun-14,Corey
1413,"205 East Houston Street, New York, NY 10002",NY 10002,Katz's Delicatessen,30,"['Breakfast', 'Takeout Available', 'Wine and Beer', 'Kosher']",4.9,excellent,"POSITIVE
   Delish pastrami. Very friendly staff Way, WAY overpriced. One experience is plenty.",17-Jun-14,MidTowner
1414,"205 East Houston Street, New York, NY 10002",NY 10002,Katz's Delicatessen,30,"['Breakfast', 'Takeout Available', 'Wine and Beer', 'Kosher']",4.9,excellent,"Not Vegan Friendly--Shocking. There are actually 5 or so items on the menu that are vegan, but the knishes are not that impressive and are put in the microwave to cook (not thoroughly). Don't lose your price ticket.",16-Jun-14,Traveling Diner
1415,"205 East Houston Street, New York, NY 10002",NY 10002,Katz's Delicatessen,30,"['Breakfast', 'Takeout Available', 'Wine and Beer', 'Kosher']",4.9,excellent,"... pastrami not bad, but by no means fantastic; sauerkraut passable, not too sour actually; bread OK, not too dense or too soft... ...
Read full post on vanbrosia.com",15-Jun-14,J At Vanbrosia.com
1417,"205 East Houston Street, New York, NY 10002",NY 10002,Katz's Delicatessen,30,"['Breakfast', 'Takeout Available', 'Wine and Beer', 'Kosher']",4.9,excellent,"NEGATIVE
   Pastrami Reuben and Matzo ball soup. The sandwich was ok. Not as good as Carnegie Deli's Pastrami Reuben but more reasonably priced. Matzo ball soup was good. It was the 1st time I have ever had it so I have nothing to compare it to but I would order it again. We waited in line for at least 30 minutes because each person in front of us ordered multiple sandwiches. It was chaotic, busy and confusing. Have to go in 1 line to order a sandwich, then another line to order drinks or side items and the have to wait again to find an empty table. I only say 1 of the sandwich guys with a smile. The rest looked like they were having a miserable day. I would eat there again if I happened to be in the neighborhood but would not make a special trip to go there. If you go, I think your best bet is to sit in the ""waiter"" section where you can have a seat and order from a menu and not have to deal with the chaos of the sandwich lines.",20-May-14,Jojo
1418,"205 East Houston Street, New York, NY 10002",NY 10002,Katz's Delicatessen,30,"['Breakfast', 'Takeout Available', 'Wine and Beer', 'Kosher']",4.9,excellent,"Long lines great food!. A must visit Deli while visiting NYC!
We had the pastrami sandwich along with the corned beef sandwich, lines were long to eat in so we decided to Über it to Central Park and eat it in the park.",9-May-14,Fallongage
1419,"205 East Houston Street, New York, NY 10002",NY 10002,Katz's Delicatessen,30,"['Breakfast', 'Takeout Available', 'Wine and Beer', 'Kosher']",4.9,excellent,"Rolled up 15 deep after a night of the LES for my bachelor party. $20 sandwich never tasted any better. Everyone comes here so anticipate lines with a bouncer to let you in. ...
Read full post on foodhipster206.com",28-Apr-14,Dave Nguyen Foodhipster206.com
1420,"205 East Houston Street, New York, NY 10002",NY 10002,Katz's Delicatessen,30,"['Breakfast', 'Takeout Available', 'Wine and Beer', 'Kosher']",4.9,excellent,"NEGATIVE
   Interesting experience, atmosphere was great, but the food extremely ordinary & service was unfriendly and uninspired.
Would not recommend.",25-Apr-14,Mark Moeller
1421,"205 East Houston Street, New York, NY 10002",NY 10002,Katz's Delicatessen,30,"['Breakfast', 'Takeout Available', 'Wine and Beer', 'Kosher']",4.9,excellent,"Great place to eat. The exact same moment that I look at these pictures, memories start to come back from this place. Awww all that delicious food. I can't help it... I officially am hungry at the moment, even thou I had something to eat an hour ago.
Really this is one of the best places in NYC",16-Apr-14,Garretlouis85
1423,"205 East Houston Street, New York, NY 10002",NY 10002,Katz's Delicatessen,30,"['Breakfast', 'Takeout Available', 'Wine and Beer', 'Kosher']",4.9,excellent,"RATED
  Over rated.. The place is a dive. The sandwiches are way to salty, the fries, potato salad and cole slaw are really nothing special. Not worth eating.

I'll be going to the 2nd Avenue Deli, instead.",21-Mar-14,Henry
1424,"205 East Houston Street, New York, NY 10002",NY 10002,Katz's Delicatessen,30,"['Breakfast', 'Takeout Available', 'Wine and Beer', 'Kosher']",4.9,excellent,"Katz's is delightfully old school, the servers are slightly gruff, the walls are unabashedly filled with memorabilia and the place clearly hasn't seen a face lift in more recent times, which just adds to the character. ...
Read full post on imsohungree.blogspot.com",16-Mar-14,Ashley
1425,"205 East Houston Street, New York, NY 10002",NY 10002,Katz's Delicatessen,30,"['Breakfast', 'Takeout Available', 'Wine and Beer', 'Kosher']",4.9,excellent,Best meat of my life. Very rich sandwiches. They carve the meat right in front of you. Shared the Reuben with my friend and it was the perfect size. It was packed when we got there and go through the line in about ten minutes! Sandwich cost $17 but worth every Penney. Would def recommend checking it out!,16-Mar-14,Jackie Tubb
1426,"205 East Houston Street, New York, NY 10002",NY 10002,Katz's Delicatessen,30,"['Breakfast', 'Takeout Available', 'Wine and Beer', 'Kosher']",4.9,excellent,"POSITIVE
   It's where I met hot pastrami. Katz's Deli, ahhh...it's an institution which makes it a tourist attraction in it's own right. The first time I went I encountered a huge line and decided not to wait because it'd be at least 2hrs..bugger that for a sandwich. The next day I was sure to arrive early and grab my ticket thus making sure I'd get to experience this institution.

The process is easy enough..take your ticket and approach the sandwich maker who will give you a sample of the pastrami, give him a tip and then tell him what you'd like. Then move down the line to the drinks and finally the desserts...then go find yourself a seat and gorge yourself silly on the finest sandwich you'll eat.

I look forward to returning this July.",14-Mar-14,Mr MM Smith
1427,"205 East Houston Street, New York, NY 10002",NY 10002,Katz's Delicatessen,30,"['Breakfast', 'Takeout Available', 'Wine and Beer', 'Kosher']",4.9,excellent,"As we were leaving, another vegetarian entered. I heard her asking the staff if there was anything for her to eat, to which they had answered: ?Of course, we have salads and potato latkes.? Sorry darl, disappointment awaited you. ...
Read full post on nouveaupotato.blogspot.com",8-Mar-14,Elisa
1428,"205 East Houston Street, New York, NY 10002",NY 10002,Katz's Delicatessen,30,"['Breakfast', 'Takeout Available', 'Wine and Beer', 'Kosher']",4.9,excellent,"This place is known for its sandwiches and the famous scene from When Harry Met Sally. The service staff are efficient and you get to try some of the meat before you purchase your meal. Delicious! ...
Read full post on onthechoppingboard.com",27-Feb-14,On The Chopping Board
1429,"205 East Houston Street, New York, NY 10002",NY 10002,Katz's Delicatessen,30,"['Breakfast', 'Takeout Available', 'Wine and Beer', 'Kosher']",4.9,excellent,"POSITIVE
   The One. This is ""the deli"" to me. I love sandwiches and they cater to those like me. I never enter into New York without stepping foot into what is the standard of delis. Turkey on rye with chopped liver and spicy mustard with a side of pickled tomatoes. Or you can really go for the gold and get the infamous pastrami but add corned beef and kraut or coleslaw with melted cheese. Need I say more.",14-Feb-14,TasteofLife412
1431,"205 East Houston Street, New York, NY 10002",NY 10002,Katz's Delicatessen,30,"['Breakfast', 'Takeout Available', 'Wine and Beer', 'Kosher']",4.9,excellent,"RATED
  The best PERIOD!! Pastrami King!!",20-Jan-14,A. Scott Kiehner
1432,"205 East Houston Street, New York, NY 10002",NY 10002,Katz's Delicatessen,30,"['Breakfast', 'Takeout Available', 'Wine and Beer', 'Kosher']",4.9,excellent,Not going to lie its really good but those greedy bast@&$s rape you on the price and if youre not careful a $120 dollar ticket will be on your car when you get out,12-Jan-14,Steve
1433,"205 East Houston Street, New York, NY 10002",NY 10002,Katz's Delicatessen,30,"['Breakfast', 'Takeout Available', 'Wine and Beer', 'Kosher']",4.9,excellent,Overpriced tourist trap. This place is a dirty over priced tourist trap. They only except cash to avoid paying required taxes. Employees are rude.,31-Dec-13,Kevcoinc
1434,"205 East Houston Street, New York, NY 10002",NY 10002,Katz's Delicatessen,30,"['Breakfast', 'Takeout Available', 'Wine and Beer', 'Kosher']",4.9,excellent,"Ask for recommendations in New York and Katz's Deli will almost always appear. I'm from an industrial town in the North of England, which feels a million miles away from the glitz of New York City, yet I know a surprising number of people who have made the trip to a glorified butty shop on the other side of the Pond. ...
Read full post on dollybakes.co.uk",30-Dec-13,DollyBakes
1435,"205 East Houston Street, New York, NY 10002",NY 10002,Katz's Delicatessen,30,"['Breakfast', 'Takeout Available', 'Wine and Beer', 'Kosher']",4.9,excellent,"Katz?s Delicatessen is the place to go for pastrami, hot dogs, corned beef, and salami. Everyone should endeavor to go at least once, no exceptions. ...
Read full post on eastvillagevibe.com",6-Dec-13,East Village Vibe
1436,"205 East Houston Street, New York, NY 10002",NY 10002,Katz's Delicatessen,30,"['Breakfast', 'Takeout Available', 'Wine and Beer', 'Kosher']",4.9,excellent,"NEGATIVE
   This place was a madhouse! Far too busy, hectic and cash only! Which they only tell you when you're at the register! I was not blown away by anything I ate and would never return here.",1-Dec-13,Lindsey Annmarie
1437,"205 East Houston Street, New York, NY 10002",NY 10002,Katz's Delicatessen,30,"['Breakfast', 'Takeout Available', 'Wine and Beer', 'Kosher']",4.9,excellent,"POSITIVE
   Great sandwiches with a mountain layer of meat mmmm and pickles! Love it",22-Nov-13,Phuong Tran
1438,"205 East Houston Street, New York, NY 10002",NY 10002,Katz's Delicatessen,30,"['Breakfast', 'Takeout Available', 'Wine and Beer', 'Kosher']",4.9,excellent,"NEGATIVE
   The cost and wait outweigh the experience. I had heard a lot about Katz's from friends and TV so I opted to try it out. At any given time there are about ten guys making sandwiches so you choose one man's line and wait. Although I appreciate the notion of hand-cutting the meat right in front of me, it took forever. Disclaimer: there is also an option to be seated and waited on, but I feel this would probably take even longer. The sandwich tasted great and filled me up for the rest of the day, but I was frustrated by the cost of $16 for a sandwich which I had to wait 20+ minutes waiting in line for.",18-Nov-13,CV Road Runner
